id,name,genre,type,episodes,avg_rating,members
896,Zetman,"Action, Drama, Horror, Romance, Sci-Fi, Seinen, Supernatural",TV,13,7.01,65633
897,Berserk: Ougon Jidai-hen III - Kourin,"Action, Adventure, Demons, Drama, Fantasy, Horror, Military, Seinen, Supernatural",Movie,1,8.33,65594
898,Sunabouzu,"Action, Adventure, Comedy, Ecchi, Sci-Fi, Shounen",TV,24,7.55,65516
899,Danganronpa 3: The End of Kibougamine Gakuen - Zetsubou-hen,"Action, Horror, Mystery, Psychological",TV,11,7.95,65503
900,"Inari, Konkon, Koi Iroha","Comedy, Romance, School, Seinen, Supernatural",TV,10,7.28,65402
901,Nisekoi OVA,"Comedy, Harem, Romance, School, Shounen",OVA,3,7.57,65287
902,Hanbun no Tsuki ga Noboru Sora,"Comedy, Drama, Romance",TV,6,7.69,65125
903,Seikimatsu Occult Gakuin,"Comedy, Mystery, School, Sci-Fi, Supernatural",TV,13,7.16,65021
904,H2O: Footprints in the Sand,"Harem, Romance, School",TV,12,7.26,64975
905,Phi Brain: Kami no Puzzle,"Action, Game, Mystery, Shounen",TV,25,7.32,64958
906,Witch Hunter Robin,"Action, Drama, Magic, Mystery, Police, Supernatural",TV,26,7.36,64905
907,Uchouten Kazoku,"Comedy, Drama, Fantasy, Slice of Life",TV,13,7.96,64897
908,Witchblade,"Action, Sci-Fi, Super Power",TV,24,7.4,64697
909,Speed Grapher,"Action, Mystery, Super Power",TV,24,7.46,64627
910,Hetalia World Series,"Comedy, Historical, Parody",ONA,48,7.95,64416
911,Joukamachi no Dandelion,"Comedy, Seinen, Slice of Life, Super Power",TV,12,7.32,64307
912,Non Non Biyori Repeat,"Comedy, School, Seinen, Slice of Life",TV,12,8.26,64230
913,Garo: Honoo no Kokuin,"Action, Demons, Fantasy, Magic, Supernatural",TV,24,7.51,64214
914,Seikon no Qwaser II,"Action, Ecchi, Seinen, Super Power, Supernatural",TV,12,6.69,64168
915,Suzuka,"Drama, Romance, Sports",TV,26,7.35,64161
916,Aishiteruze Baby,"Comedy, Drama, Romance, Shoujo",TV,26,7.58,63959
917,Hakushaku to Yousei,"Adventure, Fantasy, Historical, Magic",TV,12,7.47,63915
918,Isuca,"Action, Comedy, Ecchi, Romance, School, Seinen, Supernatural",TV,10,6.17,63638
919,Kimi no Iru Machi,"Drama, Romance, Slice of Life",TV,12,7.17,63418
920,Goshuushou-sama Ninomiya-kun,"Comedy, Ecchi, Fantasy, Harem",TV,12,6.91,63370
921,Kodomo no Jikan (TV),"Comedy, Ecchi, School",TV,12,7.13,63348
922,Seitokai Yakuindomo OVA,"Comedy, School, Shounen, Slice of Life",OVA,8,7.89,63265
923,Colorful (Movie),"Drama, Slice of Life, Supernatural",Movie,1,8.06,63263
924,Erementar Gerad,"Adventure, Comedy, Fantasy, Magic, Romance, Super Power",TV,26,7.44,63193
925,Kiniro no Corda: Primo Passo,"Comedy, Drama, Harem, Magic, Music, Romance, School, Shoujo",TV,25,7.69,63134
926,Aquarion Evol,"Action, Comedy, Drama, Fantasy, Mecha, Romance, Sci-Fi",TV,26,7.32,62753
927,Nagato Yuki-chan no Shoushitsu,"Comedy, Romance, School, Seinen, Slice of Life",TV,16,6.77,62601
